"Sentence","Response","intents","objects","synonyms","ner"
"Can I catch COVID-19 from my pet or other animals?","Several dogs and cats (domestic cats and tigers) in contact with infected humans have tested positive for COVID-19. In addition, ferrets appear to be susceptible to the infection. In experimental conditions, both cats and ferrets were\n                able to transmit infection to other animals of the same species. However, there is no evidence that these animals can transmit the disease to humans and spread COVID-19. COVID-19 is mainly spread through droplets produced when an infected\n                person coughs, sneezes, or speaks.Minks raised in farms have also been detected with the virus. Most likely, they have been infected by farm workers. In a few instances, the minks that were infected by humans have transmitted the virus to other people. These are the first\n                reported cases of animal-to-human transmission.It is still recommended that people who are sick with COVID-19 and people who are at risk limit contact with companion and other animals. When handling and caring for animals, basic hygiene measures should always be implemented. This includes\n                hand washing after handling animals, their food or supplies, as well as avoiding kissing, licking or sharing food.More recommendations are available on the OIE website: https://www.oie.int/en/scientific-expertise/specific-information-and-recommendations/questions-and-answers-on-2019novel-coronavirus/WHO continues to monitor the latest research on this and other COVID-19 topics and will update as new findings are available.","['I', 'grip', 'grasp', 'Question', 'grab', 'capture', 'hold', 'demand', 'query', 'inquiring', 'my', 'catch', 'interrogation']","['animals', 'COVID', 'pet']","['I', 'grip', 'grasp', 'Question', 'grab', 'capture', 'hold', 'demand', 'query', 'inquiring', 'my', 'catch', 'interrogation', 'animals', 'COVID', 'pet']","[]"
"How long does the virus survive on surfaces?","The most important thing to know about coronavirus on surfaces is that they can easily be cleaned with common household disinfectants that will kill the virus. Studies have shown that the COVID-19 virus can survive for up to 72 hours on plastic and stainless steel, less than 4 hours on copper and less than 24 hours on cardboard.\nAs, always clean your hands with an alcohol-based hand rub or wash them with soap and water. Avoid touching your eyes, mouth, or nose.","['Question', 'demand', 'query', 'inquiring', 'interrogation']","['surfaces', 'survive', 'virus']","['Question', 'demand', 'query', 'inquiring', 'interrogation', 'surfaces', 'survive', 'virus']","[]"
"How to grocery shop safely?","When grocery shopping, keep at least 1-metre distance from others and avoid touching your eyes, mouth and nose. If possible, sanitize the handles of shopping trolleys or baskets before shopping. Once home, wash your hands thoroughly and also after handling and storing your purchased products.\nThere is currently no confirmed case of COVID-19 transmitted through food or food packaging.","['Question', 'demand', 'query', 'inquiring', 'interrogation']","['market', 'shopping center', 'shop', 'grocery', 'mall', 'store', 'shopping centre']","['Question', 'demand', 'query', 'inquiring', 'interrogation', 'market', 'shopping center', 'shop', 'grocery', 'mall', 'store', 'shopping centre']","[]"
"How to wash fruits and vegetables?","Fruits and vegetables are important components of a healthy diet. Wash them the same way you should do under any circumstance: before handling them, wash your hands with soap and water. Then, wash fruits and vegetables thoroughly with clean water, especially if you eat them raw.","['wash down', 'clean out', 'Question', 'demand', 'rub up', 'launder', 'wash over', 'query', 'inquiring', 'wash', 'interrogation']","['vegetables', 'fruits']","['wash down', 'clean out', 'Question', 'demand', 'rub up', 'launder', 'wash over', 'query', 'inquiring', 'wash', 'interrogation', 'vegetables', 'fruits']","[]"
"Are antibiotics effective in preventing or treating COVID-19?","No. Antibiotics do not work against viruses; they only work on bacterial infections. COVID-19 is caused by a virus, so antibiotics do not work. Antibiotics should not be used as a means of prevention or treatment of COVID-19. In hospitals physicians will sometimes use antibiotics to prevent or treat secondary bacterial infections which can be a complication of COVID-19 in severely ill patients. They should only be used as directed by a physician to treat a bacterial infection.","['treating', 'Question', 'demand', 'query', 'inquiring', 'preventing', 'interrogation']","['COVID', 'antibiotics']","['treating', 'Question', 'demand', 'query', 'inquiring', 'preventing', 'interrogation', 'COVID', 'antibiotics']","[]"
"Can I catch COVID-19 from the faeces of someone with the disease?","While initial investigations suggest the virus may be present in faeces in some cases, to date, there have not been reports of faecal-oral transmission of COVID-19. Additionally, there is no evidence to date on the survival of the COVID-19 virus in water or sewage.\nWHO is assessing ongoing research on the ways COVID-19 is spread and will continue to share new findings on this topic.","['I', 'grip', 'grasp', 'Question', 'grab', 'capture', 'hold', 'demand', 'someone', 'human', 'individual', 'query', 'inquiring', 'either', 'catch', 'interrogation', 'soul', 'somebody']","['faeces', 'stool', 'dookie', 'mal', 'doo', 'sickness', 'faecal matter', 'disease', 'COVID', 'Nausea', 'malady', 'qualmishness', 'dung']","['I', 'grip', 'grasp', 'Question', 'grab', 'capture', 'hold', 'demand', 'someone', 'human', 'individual', 'query', 'inquiring', 'either', 'catch', 'interrogation', 'soul', 'somebody', 'faeces', 'stool', 'dookie', 'mal', 'doo', 'sickness', 'faecal matter', 'disease', 'COVID', 'Nausea', 'malady', 'qualmishness', 'dung']","[]"
